{
  "pipeline_version": "phase34-intelligence-pipeline-v1",
  "label": "Canonical ingestion → evidence → analytics → retrieval → deterministic → model → validation → UI",
  "model_weight_training": "NO",
  "optimization": "PROMPT_RETRIEVAL_RERANKER_TOOL_CALIBRATION_AND_MODEL_SELECTION",
  "stages": [
    "RAW_INGESTION",
    "SCHEMA_VALIDATION",
    "NORMALIZATION",
    "ENTITY_AND_PRESSING_IDENTITY_RESOLUTION",
    "AUTHORIZATION_AND_PRIVACY_FILTERING",
    "DELETION_EXPIRY_CORRECTION_APPLICATION",
    "EVIDENCE_SNAPSHOT_MATERIALIZATION",
    "MARKET_ANALYTICS_AND_DETERMINISTIC_FEATURES",
    "EMBEDDING_RETRIEVAL_RERANKING",
    "DETERMINISTIC_CAPABILITY_ENGINE",
    "MODEL_SYNTHESIS",
    "OUTPUT_SCHEMA_VALIDATION",
    "SAFETY_PRIVACY_VALIDATION",
    "API_RESPONSE",
    "CLIENT_RENDER",
    "TELEMETRY_REVIEW_EVIDENCE"
  ],
  "provenance_fields": [
    "pipeline_version",
    "source_connector",
    "source_event_id",
    "source_entity_id",
    "source_type",
    "source_owner_scope",
    "authorization_scope",
    "privacy_class",
    "ingested_at",
    "source_event_time",
    "normalized_at",
    "watermark",
    "schema_version",
    "content_hash",
    "deduplication_key",
    "identity_resolution_version",
    "pressing_identity",
    "correction_chain",
    "deletion_status",
    "expiry_status",
    "staleness_status",
    "currency_normalization_version",
    "condition_normalization_version",
    "evidence_snapshot_id",
    "evidence_snapshot_hash",
    "analytics_feature_version",
    "embedding_version",
    "retrieval_configuration_hash",
    "reranker_version",
    "prompt_configuration_id",
    "prompt_hash",
    "model_identifier",
    "model_configuration_hash",
    "output_schema_version",
    "runtime_image_digest",
    "certificate_pin",
    "request_id",
    "session_id",
    "turn_id",
    "trace_id"
  ],
  "ingestion_behaviors": [
    "idempotent_replay",
    "duplicate_suppression",
    "out_of_order_event_handling",
    "correction_precedence",
    "deletion_propagation",
    "expiry_enforcement",
    "stale_source_rejection",
    "currency_normalization",
    "sold_versus_asking_separation",
    "active_versus_completed_separation",
    "exact_pressing_versus_release_level_separation",
    "cross_user_and_cross_thread_isolation",
    "deterministic_evidence_snapshot_hashes",
    "reproducible_backfill",
    "documented_watermarks",
    "no_silent_drop_of_malformed_records"
  ],
  "authorized_evidence_bundle_fields": [
    "pipeline_version",
    "capability",
    "user_intent",
    "participant_side",
    "authorized_scope",
    "subject_identity",
    "exact_pressing_identity",
    "evidence_snapshot_id",
    "evidence_snapshot_hash",
    "sold_comparables",
    "asking_comparables",
    "auction_events",
    "normalized_market_events",
    "deterministic_metrics",
    "retrieval_results",
    "reranker_results",
    "memory_facts",
    "corrections",
    "excluded_evidence",
    "freshness",
    "limitations"
  ],
  "model_layer_may": [
    "explain",
    "summarize",
    "compare",
    "synthesize",
    "draft",
    "organize",
    "answer_follow_up"
  ],
  "model_layer_must_not": [
    "invent_sample_sizes",
    "invent_sold_counts",
    "invent_asking_counts",
    "recalculate_valuation_ranges",
    "invent_auction_velocity",
    "invent_ending_window_membership",
    "invent_market_temperature",
    "invent_trend_percentages",
    "invent_confidence_factors",
    "change_evidence_inclusion",
    "perform_currency_conversion",
    "change_exact_pressing_identity"
  ],
  "untraceable_material_claims": "FAIL_CLOSED",
  "adversarial_fixture_ids": [
    "duplicate_sold_events",
    "asking_marked_sold",
    "stale_auction_status",
    "deleted_listing",
    "currency_mismatch",
    "pressing_mismatch",
    "out_of_order_correction",
    "duplicate_catalog_across_releases",
    "unauthorized_owner_data",
    "expired_memory",
    "malformed_condition",
    "missing_event_timestamp"
  ],
  "telemetry_span_names": [
    "browser.input",
    "browser.action",
    "gateway.request",
    "authorization.check",
    "evidence.snapshot.load",
    "evidence.assemble",
    "identity.resolve",
    "analytics.compute",
    "embedding.compute",
    "retrieval.search",
    "reranker.rank",
    "tool.invoke",
    "model.request",
    "model.first_token",
    "model.generate",
    "schema.validate",
    "safety.validate",
    "privacy.validate",
    "gateway.response",
    "browser.render",
    "browser.terminal_ready",
    "screenshot.capture"
  ],
  "hard_gates": {
    "privacy_leakage": 0,
    "cross_user_leakage": 0,
    "cross_thread_leakage": 0,
    "deleted_source_influence": 0,
    "unauthorized_evidence_influence": 0,
    "asking_as_sold_violations": 0,
    "active_as_completed_violations": 0,
    "exact_pressing_false_claims": 0,
    "automatic_send_violations": 0,
    "unsupported_financial_claims": 0,
    "customer_internal_code_leaks": 0
  }
}
